[
  {
    "date": "5-8-2024",
    "url": "https://wjfvlpcyvmnhnoxeyflj.supabase.co/storage/v1/object/public/videos/Whatsinthebag-5-8.mp4?t=2024-05-08T23%3A15%3A53.089Z",
    "featured_recipe": {
      "name": "Roasted Zucchini and Beets",
      "link": "https://www.forkintheroad.co/roasted-zucchini-and-beets/"
    },
    "items": [
      {
        "name": "Zucchini",
        "source": "Sage Hill Gardens",
        "recipe": {
          "name": "See Featured Recipe",
          "link": ""
        }
      },
      {
        "name": "Beets",
        "source": "Cardiff Tiny Farm",
        "recipe": {
          "name": "See Featured Recipe",
          "link": ""
        }
      },
      {
        "name": "Red Romaine",
        "source": "Cardiff Tiny Farm",
        "recipe": {
          "name": "Caesar Salad With Red Romaine",
          "link": "https://www.foodnetwork.com/recipes/geoffrey-zakarian/caesar-salad-with-red-romaine-recipe-2119558"
        }
      },
      {
        "name": "Arugula",
        "source": "Cardiff Tiny Farm",
        "recipe": {
          "name": "Sauteed Arugula",
          "link": "https://www.alphafoodie.com/sauteed-arugula-recipe/"
        }
      },
      {
        "name": "Fennel",
        "source": "Cardiff Tiny Farm",
        "recipe": {
          "name": "",
          "link": ""
        }
      },
      {
        "name": "Collard Greens + Swiss Chard",
        "source": "Cardiff Tiny Farm",
        "recipe": {
          "name": "Collard and Fennel Salad with Crispy Plantains",
          "link": "https://www.foodandwine.com/recipes/collard-and-fennel-salad-crispy-plantains"
        }
      },
      {
        "name": "Herb Bundle",
        "source": "Cardiff Tiny Farm",
        "recipe": {
          "name": "",
          "link": ""
        }
      }
    ]
  },
  {
    "date": "5-1-2024",
    "url": "https://wjfvlpcyvmnhnoxeyflj.supabase.co/storage/v1/object/public/videos/5-1.mov?t=2024-05-02T01%3A46%3A38.704Z",
    "featured_recipe": {
      "name": "Cucumber Radish Salad",
      "link": "https://www.themediterraneandish.com/cucumber-radish-salad/"
    },
    "items": [
      {
        "name": "Zucchini",
        "source": "JR Organics",
        "recipe": {
          "name": "Cucumber Zucchini Salad",
          "link": "https://www.food.com/recipe/cucumber-zucchini-salad-172804"
        }
      },
      {
        "name": "Cucumbers",
        "source": "JR Organics",
        "recipe": {
          "name": "",
          "link": ""
        }
      },
      {
        "name": "Onions",
        "source": "JR Organics",
        "recipe": {
          "name": "Caramelized Fennel and Onions",
          "link": "https://www.simplyrecipes.com/recipes/caramelized_fennel_and_onions/"
        }
      },
      {
        "name": "Romaine Lettuce",
        "source": "Cardiff Tiny Farm",
        "recipe": {
          "name": "",
          "link": ""
        }
      },
      {
        "name": "Arugula",
        "source": "Cardiff Tiny Farm",
        "recipe": {
          "name": "",
          "link": ""
        }
      },
      {
        "name": "Collard Greens",
        "source": "Cardiff Tiny Farm",
        "recipe": {
          "name": "",
          "link": ""
        }
      },
      {
        "name": "Celery",
        "source": "Cardiff Tiny Farm",
        "recipe": {
          "name": "",
          "link": ""
        }
      },
      {
        "name": "Fennel",
        "source": "Cardiff Tiny Farm",
        "recipe": {
          "name": "Caramelized Fennel and Onions",
          "link": "https://www.simplyrecipes.com/recipes/caramelized_fennel_and_onions/"
        }
      },
      {
        "name": "Raddish",
        "source": "Cardiff Tiny Farm",
        "recipe": {
          "name": "",
          "link": ""
        }
      },
      {
        "name": "Flowers",
        "source": "@beeworthyfarms",
        "recipe": {
          "name": "Check out BeeWorthy's amazing products!",
          "link": "https://www.beeworthyfarms.com/"
        }
      }
    ]
  },
  {
    "date": "4-24-2024",
    "url": "https://wjfvlpcyvmnhnoxeyflj.supabase.co/storage/v1/object/public/videos/4-24.MOV?t=2024-04-24T22%3A07%3A10.646Z",
    "featured_recipe": {
      "name": "Zucchini Radish Salad",
      "link": "https://www.melaniecooks.com/zucchini-radish-salad/22627/"
    },
    "items": [
      {
        "name": "Zucchini",
        "source": "JR Organics",
        "recipe": {
          "name": "",
          "link": ""
        }
      },
      {
        "name": "Romaine Lettuce",
        "source": "Cardiff Tiny Farm",
        "recipe": {
          "name": "",
          "link": ""
        }
      },
      {
        "name": "Beets",
        "source": "Cardiff Tiny Farm",
        "recipe": {
          "name": "",
          "link": ""
        }
      },
      {
        "name": "Collard Greens",
        "source": "Cardiff Tiny Farm",
        "recipe": {
          "name": "",
          "link": ""
        }
      },
      {
        "name": "Swiss Chard",
        "source": "Cardiff Tiny Farm",
        "recipe": {
          "name": "",
          "link": ""
        }
      },
      {
        "name": "Raddish",
        "source": "Cardiff Tiny Farm",
        "recipe": {
          "name": "",
          "link": ""
        }
      },
      {
        "name": "Lemon",
        "source": "Cardiff Tiny Farm",
        "recipe": {
          "name": "",
          "link": ""
        }
      }
    ]
  },
  {
    "date": "4-17-2024",
    "url": "https://wjfvlpcyvmnhnoxeyflj.supabase.co/storage/v1/object/public/videos/4-17.mov?t=2024-04-17T20%3A36%3A09.620Z",
    "featured_recipe": {
      "name": "Lettuce and cucumber salad recipe",
      "link": "https://insimoneskitchen.com/lettuce-cucumber-salad-donna-hay-13/"
    },
    "items": [
      {
        "name": "Cucumbers",
        "source": "JR Organics",
        "recipe": {
          "name": "",
          "link": ""
        }
      },
      {
        "name": "Romaine Lettuce",
        "source": "Cardiff Tiny Farm",
        "recipe": {
          "name": "",
          "link": ""
        }
      },
      {
        "name": "Arugula",
        "source": "Cardiff Tiny Farm",
        "recipe": {
          "name": "",
          "link": ""
        }
      },
      {
        "name": "Collard Greens",
        "source": "Cardiff Tiny Farm",
        "recipe": {
          "name": "",
          "link": ""
        }
      },
      {
        "name": "Swiss Chard",
        "source": "Cardiff Tiny Farm",
        "recipe": {
          "name": "",
          "link": ""
        }
      },
      {
        "name": "Cilantro",
        "source": "Cardiff Tiny Farm",
        "recipe": {
          "name": "",
          "link": ""
        }
      },
      {
        "name": "Flowers",
        "source": "@beeworthyfarms",
        "recipe": {
          "name": "Check out BeeWorthy's amazing products!",
          "link": "https://www.beeworthyfarms.com/"
        }
      }
    ]
  },
  {
    "date": "4-10-2024",
    "url": "https://wjfvlpcyvmnhnoxeyflj.supabase.co/storage/v1/object/public/videos/4-10.MOV?t=2024-04-10T19%3A27%3A20.534Z",
    "featured_recipe": {
      "name": "Roasted Kohlrabi with Parmesan",
      "link": "https://www.foodnetwork.com/recipes/food-network-kitchen/roasted-kohlrabi-with-parmesan-3561919"
    },
    "items": [
      {
        "name": "Kholrabi",
        "source": "Cardiff Tiny Farm",
        "recipe": {
          "name": "",
          "link": ""
        }
      },
      {
        "name": "Romaine Lettuce",
        "source": "Cardiff Tiny Farm",
        "recipe": {
          "name": "",
          "link": ""
        }
      },
      {
        "name": "Arugula",
        "source": "Cardiff Tiny Farm",
        "recipe": {
          "name": "",
          "link": ""
        }
      },
      {
        "name": "Collard Greens",
        "source": "Cardiff Tiny Farm",
        "recipe": {
          "name": "",
          "link": ""
        }
      },
      {
        "name": "Swiss Chard",
        "source": "Cardiff Tiny Farm",
        "recipe": {
          "name": "",
          "link": ""
        }
      },
      {
        "name": "Cilantro",
        "source": "Cardiff Tiny Farm",
        "recipe": {
          "name": "",
          "link": ""
        }
      },
      {
        "name": "Kale",
        "source": "Cardiff Tiny Farm",
        "recipe": {
          "name": "",
          "link": ""
        }
      },
      {
        "name": "Hot Sauce",
        "source": "San Diego Pepper Co.",
        "recipe": {
          "name": "",
          "link": ""
        }
      }
    ]
  },
  {
    "date": "3-27-2024",
    "url": "https://wjfvlpcyvmnhnoxeyflj.supabase.co/storage/v1/object/public/videos/3-27.MOV?t=2024-03-27T21%3A17%3A57.966Z",
    "featured_recipe": {
      "name": "Carrot Kale Stir Fry",
      "link": "https://www.mycurryveda.com/carrot-kale-stir-fry"
    },
    "items": [
      {
        "name": "Carrots",
        "source": "JR Organics",
        "recipe": {
          "name": "",
          "link": ""
        }
      },
      {
        "name": "Romaine Lettuce",
        "source": "Cardiff Tiny Farm",
        "recipe": {
          "name": "",
          "link": ""
        }
      },
      {
        "name": "Baby Kale",
        "source": "Cardiff Tiny Farm",
        "recipe": {
          "name": "",
          "link": ""
        }
      },
      {
        "name": "Collard Greens",
        "source": "Cardiff Tiny Farm",
        "recipe": {
          "name": "",
          "link": ""
        }
      },
      {
        "name": "Beets",
        "source": "Cardiff Tiny Farm",
        "recipe": {
          "name": "",
          "link": ""
        }
      },
      {
        "name": "Swiss Chard",
        "source": "Cardiff Tiny Farm",
        "recipe": {
          "name": "",
          "link": ""
        }
      },
      {
        "name": "Raddish",
        "source": "Cardiff Tiny Farm",
        "recipe": {
          "name": "",
          "link": ""
        }
      },
      {
        "name": "Cilantro",
        "source": "Cardiff Tiny Farm",
        "recipe": {
          "name": "",
          "link": ""
        }
      },
      {
        "name": "Protea Flowers",
        "source": "Cardiff Tiny Farm",
        "recipe": {
          "name": "",
          "link": ""
        }
      }
    ]
  },
  {
    "date": "3-20-2024",
    "url": "https://wjfvlpcyvmnhnoxeyflj.supabase.co/storage/v1/object/public/videos/3-20.MOV?t=2024-03-20T19%3A08%3A09.380Z",
    "featured_recipe": {
      "name": "Spicy Stir-Fried Fennel and Carrots",
      "link": "https://1tess.wordpress.com/2008/08/09/spicy-stir-fried-fennel-and-carrots/"
    },
    "items": [
      {
        "name": "Carrots",
        "source": "JR Organics",
        "recipe": {
          "name": "",
          "link": ""
        }
      },
      {
        "name": "Lemons",
        "source": "@wolfmedicine_",
        "recipe": {
          "name": "",
          "link": ""
        }
      },
      {
        "name": "Tat Soi",
        "source": "Sage Hill Gardens Farm",
        "recipe": {
          "name": "",
          "link": ""
        }
      },
      {
        "name": "Romaine Lettuce",
        "source": "Cardiff Tiny Farm",
        "recipe": {
          "name": "",
          "link": ""
        }
      },
      {
        "name": "Collard Greens",
        "source": "Cardiff Tiny Farm",
        "recipe": {
          "name": "",
          "link": ""
        }
      },
      {
        "name": "Beets",
        "source": "Cardiff Tiny Farm",
        "recipe": {
          "name": "",
          "link": ""
        }
      },
      {
        "name": "Swiss Chard",
        "source": "Cardiff Tiny Farm",
        "recipe": {
          "name": "",
          "link": ""
        }
      },
      {
        "name": "Fennel",
        "source": "Cardiff Tiny Farm",
        "recipe": {
          "name": "",
          "link": ""
        }
      },
      {
        "name": "Flower Bundle",
        "source": "Cardiff Tiny Farm",
        "recipe": {
          "name": "",
          "link": ""
        }
      },
      {
        "name": "Herb Bundle",
        "source": "Cardiff Tiny Farm",
        "recipe": {
          "name": "",
          "link": ""
        }
      }
    ]
  },
  {
    "date": "3-13-2024",
    "url": "https://wjfvlpcyvmnhnoxeyflj.supabase.co/storage/v1/object/public/videos/3-13.MOV?t=2024-03-13T20%3A13%3A09.966Z",
    "featured_recipe": {
      "name": "Broccoli Kale Cilantro Sambol (Salad)",
      "link": "https://savoryspin.com/broccoli-kale-cilantro-sambol-salad-2/"
    },
    "items": [
      {
        "name": "Broccoli",
        "source": "JR Organics",
        "recipe": {
          "name": "",
          "link": ""
        }
      },
      {
        "name": "Kale Bundle",
        "source": "JR Organics",
        "recipe": {
          "name": "",
          "link": ""
        }
      },
      {
        "name": "Baby Arugula",
        "source": "Cardiff Tiny Farm",
        "recipe": {
          "name": "",
          "link": ""
        }
      },
      {
        "name": "Romaine Lettuce",
        "source": "Cardiff Tiny Farm",
        "recipe": {
          "name": "",
          "link": ""
        }
      },
      {
        "name": "Collards",
        "source": "Cardiff Tiny Farm",
        "recipe": {
          "name": "",
          "link": ""
        }
      },
      {
        "name": "Swiss Chard",
        "source": "Cardiff Tiny Farm",
        "recipe": {
          "name": "",
          "link": ""
        }
      },
      {
        "name": "Beets",
        "source": "Cardiff Tiny Farm",
        "recipe": {
          "name": "",
          "link": ""
        }
      },
      {
        "name": "Flower Bundle",
        "source": "Cardiff Tiny Farm",
        "recipe": {
          "name": "",
          "link": ""
        }
      },
      {
        "name": "Herb Bundle",
        "source": "Cardiff Tiny Farm",
        "recipe": {
          "name": "",
          "link": ""
        }
      }
    ]
  },
  {
    "date": "3-6-2024",
    "url": "https://wjfvlpcyvmnhnoxeyflj.supabase.co/storage/v1/object/public/videos/3-6.MOV?t=2024-03-06T17%3A39%3A34.533Z",
    "featured_recipe": {
      "name": "Maple-Glazed Parsnips on Kale",
      "link": "https://www.tasteofhome.com/recipes/maple-glazed-parsnips-on-kale/"
    },
    "items": [
      {
        "name": "Parsnips",
        "source": "JR Organics",
        "recipe": {
          "name": "",
          "link": ""
        }
      },
      {
        "name": "Kale Bundle",
        "source": "JR Organics",
        "recipe": {
          "name": "",
          "link": ""
        }
      },
      {
        "name": "Baby Arugula",
        "source": "Cardiff Tiny Farm",
        "recipe": {
          "name": "",
          "link": ""
        }
      },
      {
        "name": "Collards",
        "source": "Cardiff Tiny Farm",
        "recipe": {
          "name": "",
          "link": ""
        }
      },
      {
        "name": "Swiss Chard",
        "source": "Cardiff Tiny Farm",
        "recipe": {
          "name": "",
          "link": ""
        }
      },
      {
        "name": "Beets",
        "source": "Cardiff Tiny Farm",
        "recipe": {
          "name": "",
          "link": ""
        }
      },
      {
        "name": "Flower Bundle",
        "source": "Cardiff Tiny Farm",
        "recipe": {
          "name": "",
          "link": ""
        }
      }
    ]
  },
  {
    "date": "2-28-2024",
    "url": "https://wjfvlpcyvmnhnoxeyflj.supabase.co/storage/v1/object/public/videos/WITH-2-28-v2.mp4?t=2024-02-28T19%3A50%3A01.841Z",
    "featured_recipe": {
      "name": "Arugula and Romaine Salad with Capers and Prosciutto",
      "link": "https://www.mediterraneanliving.com/salad-with-capers-and-prosciutto/"
    },
    "items": [
      {
        "name": "Celery",
        "source": "Sage Hill Gardens Farm",
        "recipe": {
          "name": "Celery and Apple Salad",
          "link": "https://www.splendidtable.org/story/2015/11/06/celery-and-apple-salad"
        }
      },
      {
        "name": "Romaine Lettuce",
        "source": "JR Organics",
        "recipe": {
          "name": "",
          "link": ""
        }
      },
      {
        "name": "Baby Arugula",
        "source": "Cardiff Tiny Farm",
        "recipe": {
          "name": "",
          "link": ""
        }
      },
      {
        "name": "Collards",
        "source": "Cardiff Tiny Farm",
        "recipe": {
          "name": "",
          "link": ""
        }
      },
      {
        "name": "Swiss Chard",
        "source": "Cardiff Tiny Farm",
        "recipe": {
          "name": "",
          "link": ""
        }
      },
      {
        "name": "Beets",
        "source": "Cardiff Tiny Farm",
        "recipe": {
          "name": "",
          "link": ""
        }
      }
    ]
  },
  {
    "date": "2-21-2024",
    "url": "https://wjfvlpcyvmnhnoxeyflj.supabase.co/storage/v1/object/public/videos/2-21.MOV?t=2024-02-21T17%3A44%3A47.229Z",
    "featured_recipe": {
      "name": "Braising Greens with Cilantro and Rice",
      "link": "https://ripleyorganicfarm.com/recipes/Tatsoi"
    },
    "items": [
      {
        "name": "Tat Soi",
        "source": "Sage Hill Gardens Farm",
        "recipe": {
          "name": "",
          "link": ""
        }
      },
      {
        "name": "Bunching Onions",
        "source": "Morning Star Ranch",
        "recipe": {
          "name": "",
          "link": ""
        }
      },
      {
        "name": "Spicy Lettuce Mix",
        "source": "@jaminluoto",
        "recipe": {
          "name": "",
          "link": ""
        }
      },
      {
        "name": "Collards",
        "source": "Cardiff Tiny Farm",
        "recipe": {
          "name": "",
          "link": ""
        }
      },
      {
        "name": "Swiss Chard",
        "source": "Cardiff Tiny Farm",
        "recipe": {
          "name": "",
          "link": ""
        }
      },
      {
        "name": "Beets",
        "source": "Cardiff Tiny Farm",
        "recipe": {
          "name": "",
          "link": ""
        }
      },
      {
        "name": "Cilantro",
        "source": "Cardiff Tiny Farm",
        "recipe": {
          "name": "",
          "link": ""
        }
      }
    ]
  },
  {
    "date": "2-14-2024",
    "url": "https://wjfvlpcyvmnhnoxeyflj.supabase.co/storage/v1/object/public/videos/2-14.MOV?t=2024-02-14T17%3A48%3A39.352Z",
    "featured_recipe": {
      "name": "Parsnip and Celery Soup with Garlic oil and Kale Chips",
      "link": "https://irenematys.com/roasted-parsnip-celery-soup/"
    },
    "items": [
      {
        "name": "Parsnips",
        "source": "JR Organics",
        "recipe": {
          "name": "",
          "link": ""
        }
      },
      {
        "name": "Celery",
        "source": "Sage Hill Gardens Farm",
        "recipe": {
          "name": "",
          "link": ""
        }
      },
      {
        "name": "Oranges",
        "source": "@wolfspiritlove",
        "recipe": {
          "name": "",
          "link": ""
        }
      },
      {
        "name": "Arugula",
        "source": "Cardiff Tiny Farm",
        "recipe": {
          "name": "",
          "link": ""
        }
      },
      {
        "name": "Collards",
        "source": "Cardiff Tiny Farm",
        "recipe": {
          "name": "",
          "link": ""
        }
      },
      {
        "name": "Swiss Chard",
        "source": "Cardiff Tiny Farm",
        "recipe": {
          "name": "",
          "link": ""
        }
      },
      {
        "name": "Baby Kale",
        "source": "Cardiff Tiny Farm",
        "recipe": {
          "name": "",
          "link": ""
        }
      },
      {
        "name": "Flower Bundle",
        "source": "Cardiff Tiny Farm",
        "recipe": {
          "name": "",
          "link": ""
        }
      }
    ]
  },
  {
    "date": "2-7-2024",
    "url": "https://wjfvlpcyvmnhnoxeyflj.supabase.co/storage/v1/object/public/videos/2-7.MOV?t=2024-02-07T17%3A44%3A14.522Z",
    "featured_recipe": {
      "name": "Carrot and Kohlrabi Slaw",
      "link": "https://www.thespruceeats.com/carrot-kohlrabi-slaw-2217352"
    },
    "items": [
      {
        "name": "Carrots",
        "source": "Sage Hill Gardens Farm",
        "recipe": {
          "name": "",
          "link": ""
        }
      },
      {
        "name": "Kholrabi",
        "source": "JR Organics",
        "recipe": {
          "name": "Sautéed Kohlrabi (with the greens)",
          "link": "https://itsavegworldafterall.com/sauteed-kohlrabi/"
        }
      },
      {
        "name": "Spicy Lettuce Mix",
        "source": "@jaminluoto",
        "recipe": {
          "name": "",
          "link": ""
        }
      },
      {
        "name": "Collards",
        "source": "Cardiff Tiny Farm",
        "recipe": {
          "name": "",
          "link": ""
        }
      },
      {
        "name": "Broccoli",
        "source": "Cardiff Tiny Farm",
        "recipe": {
          "name": "",
          "link": ""
        }
      },
      {
        "name": "Beets",
        "source": "Cardiff Tiny Farm",
        "recipe": {
          "name": "",
          "link": ""
        }
      }
    ]
  },
  {
    "date": "1-31-2024",
    "url": "https://wjfvlpcyvmnhnoxeyflj.supabase.co/storage/v1/object/public/videos/1-31-24.MOV?t=2024-01-31T17%3A39%3A48.591Z",
    "featured_recipe": {
      "name": "Roasted Asparagus and Carrots",
      "link": "https://itsavegworldafterall.com/roasted-asparagus-and-carrots/"
    },
    "items": [
      {
        "name": "Carrots",
        "source": "R & L Farms",
        "recipe": {
          "name": "",
          "link": ""
        }
      },
      {
        "name": "Asparagus",
        "source": "R & L Farms",
        "recipe": {
          "name": "",
          "link": ""
        }
      },
      {
        "name": "Snow Peas",
        "source": "R & L Farms",
        "recipe": {
          "name": "",
          "link": ""
        }
      },
      {
        "name": "Collards",
        "source": "Cardiff Tiny Farm",
        "recipe": {
          "name": "Quick Collard Greens",
          "link": "https://cookieandkate.com/quick-collard-greens-recipe/"
        }
      },
      {
        "name": "Swiss Chard",
        "source": "Cardiff Tiny Farm",
        "recipe": {
          "name": "",
          "link": ""
        }
      },
      {
        "name": "Baby Kale",
        "source": "Cardiff Tiny Farm",
        "recipe": {
          "name": "",
          "link": ""
        }
      },
      {
        "name": "Beets",
        "source": "Cardiff Tiny Farm",
        "recipe": {
          "name": "",
          "link": ""
        }
      },
      {
        "name": "Flowers",
        "source": "Cardiff Tiny Farm",
        "recipe": {
          "name": "",
          "link": ""
        }
      }
    ]
  },
  {
    "date": "1-24-2024",
    "url": "https://wjfvlpcyvmnhnoxeyflj.supabase.co/storage/v1/object/public/videos/1-24.MOV?t=2024-01-24T17%3A56%3A57.015Z",
    "featured_recipe": {
      "name": "Broccoli & Tatsoi in Garlic Sauce",
      "link": "https://www.healthygffamily.com/recipe/broccoli-bok-choy-eggplant-in-garlic-sauce/"
    },
    "items": [
      {
        "name": "Tat Soi",
        "source": "Sage Hill Gardens Farm",
        "recipe": {
          "name": "",
          "link": ""
        }
      },
      {
        "name": "Bunching Onions",
        "source": "Sage Hill Gardens Farm",
        "recipe": {
          "name": "",
          "link": ""
        }
      },
      {
        "name": "Broccoli",
        "source": "JR Organics",
        "recipe": {
          "name": "",
          "link": ""
        }
      },
      {
        "name": "Beets",
        "source": "Cardiff Tiny Farm",
        "recipe": {
          "name": "",
          "link": ""
        }
      },
      {
        "name": "Collard Greens",
        "source": "Cardiff Tiny Farm",
        "recipe": {
          "name": "Stir Fried Collard Greens",
          "link": "https://www.foodnetwork.com/recipes/stir-fried-collard-greens-recipe-1943340"
        }
      },
      {
        "name": "Raddish",
        "source": "Cardiff Tiny Farm",
        "recipe": {
          "name": "",
          "link": ""
        }
      },
      {
        "name": "Herb Bundle",
        "source": "Cardiff Tiny Farm",
        "recipe": {
          "name": "",
          "link": ""
        }
      }
    ]
  },
  {
    "date": "1-17-2024",
    "url": "https://wjfvlpcyvmnhnoxeyflj.supabase.co/storage/v1/object/public/videos/1-17-24.MOV?t=2024-01-17T17%3A58%3A15.823Z",
    "featured_recipe": {
      "name": "Beet Bowl with Chimichurri Vinagrette",
      "link": "https://thatvegannephew.com/roasted-beet-bowl-with-chimichurri-vinaigrette/"
    },
    "items": [
      {
        "name": "Carrots",
        "source": "Sage Hill Gardens Farm",
        "recipe": {
          "name": "Carrot Top Chimichurri",
          "link": "https://www.loveandlemons.com/carrot-greens-chimichurri/"
        }
      },
      {
        "name": "Naval Oranges",
        "source": "Behenmen Farm",
        "recipe": {
          "name": "",
          "link": ""
        }
      },
      {
        "name": "Collard Greens",
        "source": "Cardiff Tiny Farm",
        "recipe": {
          "name": "",
          "link": ""
        }
      },
      {
        "name": "Swiss Chard",
        "source": "Cardiff Tiny Farm",
        "recipe": {
          "name": "",
          "link": ""
        }
      },
      {
        "name": "Arugula",
        "source": "Cardiff Tiny Farm",
        "recipe": {
          "name": "",
          "link": ""
        }
      },
      {
        "name": "Kale Mix",
        "source": "Cardiff Tiny Farm",
        "recipe": {
          "name": "",
          "link": ""
        }
      },
      {
        "name": "Beets",
        "source": "Cardiff Tiny Farm",
        "recipe": {
          "name": "",
          "link": ""
        }
      },
      {
        "name": "Cocktail Grapefruit",
        "source": "Cardiff Tiny Farm",
        "recipe": {
          "name": "Grapefruit Sunrise Cocktail",
          "link": "https://theblondcook.com/grapefruit-sunrise-cocktail/"
        }
      }
    ]
  },
  {
    "date": "1-10-2024",
    "url": "https://wjfvlpcyvmnhnoxeyflj.supabase.co/storage/v1/object/public/videos/1-10-24.MOV?t=2024-01-10T17%3A55%3A27.092Z",
    "featured_recipe": {
      "name": "Best Buddha Bowl",
      "link": "https://www.loveandlemons.com/buddha-bowl-recipe/"
    },
    "items": [
      {
        "name": "Watermelon Raddish",
        "source": "JR Organics",
        "recipe": {
          "name": "",
          "link": ""
        }
      },
      {
        "name": "Cilantro",
        "source": "Sage Hill Gardens Farm",
        "recipe": {
          "name": "Cilantro Lime Dressing",
          "link": "https://www.loveandlemons.com/cilantro-lime-dressing/"
        }
      },
      {
        "name": "Green Onions",
        "source": "Sage Hill Gardens Farm",
        "recipe": {
          "name": "",
          "link": ""
        }
      },
      {
        "name": "Collard Greens",
        "source": "Cardiff Tiny Farm",
        "recipe": {
          "name": "",
          "link": ""
        }
      },
      {
        "name": "Swiss Chard",
        "source": "Cardiff Tiny Farm",
        "recipe": {
          "name": "",
          "link": ""
        }
      },
      {
        "name": "Arugula",
        "source": "Cardiff Tiny Farm",
        "recipe": {
          "name": "",
          "link": ""
        }
      },
      {
        "name": "Kale Mix",
        "source": "Cardiff Tiny Farm",
        "recipe": {
          "name": "",
          "link": ""
        }
      },
      {
        "name": "Beets",
        "source": "Cardiff Tiny Farm",
        "recipe": {
          "name": "Pickeled Beets",
          "link": "https://www.cookingclassy.com/pickled-beets/"
        }
      },
      {
        "name": "Thai Basil",
        "source": "Cardiff Tiny Farm",
        "recipe": {
          "name": "",
          "link": ""
        }
      },
      {
        "name": "Sprouts Mix",
        "source": "Cardiff Tiny Farm",
        "recipe": {
          "name": "",
          "link": ""
        }
      },
      {
        "name": "Mustard Greens",
        "source": "Kendra's Garden",
        "recipe": {
          "name": "",
          "link": ""
        }
      }
    ]
  },
  {
    "date": "1-3-2024",
    "url": "https://wjfvlpcyvmnhnoxeyflj.supabase.co/storage/v1/object/public/videos/1-3-23.MOV?t=2024-01-09T21%3A04%3A12.812Z",
    "items": [
      {
        "name": "Spaghetti Squash",
        "source": "JR Organics",
        "recipe": {
          "name": "",
          "link": ""
        }
      },
      {
        "name": "Tat Soi",
        "source": "Sage Hill Gardens Farm",
        "recipe": {
          "name": "",
          "link": ""
        }
      },
      {
        "name": "Raddish",
        "source": "Sage Hill Gardens Farm",
        "recipe": {
          "name": "",
          "link": ""
        }
      },
      {
        "name": "Collard Greens",
        "source": "Cardiff Tiny Farm",
        "recipe": {
          "name": "",
          "link": ""
        }
      },
      {
        "name": "Swiss Chard",
        "source": "Cardiff Tiny Farm",
        "recipe": {
          "name": "",
          "link": ""
        }
      },
      {
        "name": "Arugula",
        "source": "Cardiff Tiny Farm",
        "recipe": {
          "name": "",
          "link": ""
        }
      },
      {
        "name": "Kale Mix",
        "source": "Cardiff Tiny Farm",
        "recipe": {
          "name": "",
          "link": ""
        }
      },
      {
        "name": "Goose Berries",
        "source": "Cardiff Tiny Farm",
        "recipe": {
          "name": "",
          "link": ""
        }
      },
      {
        "name": "Thai Basil",
        "source": "Cardiff Tiny Farm",
        "recipe": {
          "name": "",
          "link": ""
        }
      }
    ]
  }
]